{
  "$comment": "由 packages/content-schema 產生，不要手改；執行 pnpm schemas:build 重新產生。",
  "$schema": "http://json-schema.org/draft-07/schema#",
  "type": "object",
  "properties": {
    "rev": {
      "$ref": "#/definitions/__schema0"
    },
    "revKind": {
      "$ref": "#/definitions/__schema1"
    },
    "status": {
      "$ref": "#/definitions/__schema2"
    },
    "supersededBy": {
      "$ref": "#/definitions/__schema3"
    },
    "retiredNote": {
      "$ref": "#/definitions/__schema4"
    },
    "authorNotes": {
      "$ref": "#/definitions/__schema7"
    },
    "updatedAt": {
      "$ref": "#/definitions/__schema8"
    },
    "id": {
      "$ref": "#/definitions/__schema9"
    },
    "title": {
      "$ref": "#/definitions/LocalizedText"
    },
    "origin": {
      "$ref": "#/definitions/__schema10"
    },
    "company": {
      "$ref": "#/definitions/__schema11"
    },
    "ledger": {
      "$ref": "#/definitions/__schema12"
    },
    "opening": {
      "$ref": "#/definitions/__schema13"
    },
    "policy": {
      "$ref": "#/definitions/__schema14"
    },
    "layout": {
      "$ref": "#/definitions/__schema15"
    },
    "steps": {
      "$ref": "#/definitions/__schema16"
    }
  },
  "required": [
    "rev",
    "revKind",
    "status",
    "id",
    "title",
    "origin",
    "company",
    "ledger",
    "policy",
    "layout",
    "steps"
  ],
  "additionalProperties": false,
  "definitions": {
    "__schema0": {
      "type": "integer",
      "minimum": 1,
      "maximum": 9007199254740991
    },
    "__schema1": {
      "type": "string",
      "enum": [
        "text",
        "answer"
      ]
    },
    "__schema2": {
      "type": "string",
      "enum": [
        "draft",
        "published",
        "retired"
      ]
    },
    "__schema3": {
      "type": "string"
    },
    "__schema4": {
      "allOf": [
        {
          "$ref": "#/definitions/LocalizedText"
        }
      ]
    },
    "LocalizedText": {
      "type": "object",
      "properties": {
        "zh-TW": {
          "$ref": "#/definitions/__schema5"
        },
        "en": {
          "$ref": "#/definitions/__schema6"
        }
      },
      "required": [
        "zh-TW"
      ],
      "additionalProperties": false
    },
    "__schema5": {
      "type": "string",
      "minLength": 1
    },
    "__schema6": {
      "type": "string",
      "minLength": 1
    },
    "__schema7": {
      "type": "string"
    },
    "__schema8": {
      "type": "string",
      "format": "date-time",
      "pattern": "^(?:(?:\\d\\d[2468][048]|\\d\\d[13579][26]|\\d\\d0[48]|[02468][048]00|[13579][26]00)-02-29|\\d{4}-(?:(?:0[13578]|1[02])-(?:0[1-9]|[12]\\d|3[01])|(?:0[469]|11)-(?:0[1-9]|[12]\\d|30)|(?:02)-(?:0[1-9]|1\\d|2[0-8])))T(?:(?:[01]\\d|2[0-3]):[0-5]\\d:[0-5]\\d(?:\\.\\d+)?(?:Z|([+-](?:[01]\\d|2[0-3]):[0-5]\\d)))$"
    },
    "__schema9": {
      "type": "string",
      "pattern": "^story_[0123456789abcdefghjkmnpqrstvwxyz]{6}$"
    },
    "__schema10": {
      "type": "string",
      "enum": [
        "teacher",
        "original"
      ]
    },
    "__schema11": {
      "type": "object",
      "properties": {
        "name": {
          "$ref": "#/definitions/LocalizedText"
        }
      },
      "required": [
        "name"
      ],
      "additionalProperties": false
    },
    "__schema12": {
      "type": "object",
      "properties": {
        "currency": {
          "type": "string",
          "const": "TWD"
        },
        "scale": {
          "type": "number",
          "const": 0
        }
      },
      "required": [
        "currency",
        "scale"
      ],
      "additionalProperties": false
    },
    "__schema13": {
      "type": "object",
      "propertyNames": {
        "$ref": "#/definitions/SemanticId"
      },
      "additionalProperties": {
        "$ref": "#/definitions/Money"
      }
    },
    "SemanticId": {
      "type": "string",
      "pattern": "^[a-z][a-z0-9_]*$"
    },
    "Money": {
      "type": "integer",
      "minimum": 0,
      "maximum": 9007199254740991
    },
    "__schema14": {
      "type": "string",
      "const": "teacher@1"
    },
    "__schema15": {
      "type": "string",
      "const": "teacher@1"
    },
    "__schema16": {
      "minItems": 1,
      "type": "array",
      "items": {
        "$ref": "#/definitions/StoryStep"
      }
    },
    "StoryStep": {
      "type": "object",
      "properties": {
        "id": {
          "$ref": "#/definitions/__schema17"
        },
        "order": {
          "$ref": "#/definitions/__schema18"
        },
        "title": {
          "$ref": "#/definitions/LocalizedText"
        },
        "narrative": {
          "$ref": "#/definitions/LocalizedText"
        },
        "events": {
          "$ref": "#/definitions/__schema19"
        },
        "termRefs": {
          "$ref": "#/definitions/__schema21"
        },
        "chapterLinks": {
          "$ref": "#/definitions/__schema22"
        },
        "checkpoints": {
          "$ref": "#/definitions/__schema23"
        },
        "predictTargets": {
          "$ref": "#/definitions/__schema24"
        },
        "stakeholders": {
          "$ref": "#/definitions/__schema30"
        },
        "verification": {
          "$ref": "#/definitions/__schema31"
        }
      },
      "required": [
        "id",
        "order",
        "title",
        "narrative",
        "events",
        "termRefs"
      ],
      "additionalProperties": false
    },
    "__schema17": {
      "type": "string",
      "pattern": "^st_[0123456789abcdefghjkmnpqrstvwxyz]{6}$"
    },
    "__schema18": {
      "type": "integer",
      "minimum": 1,
      "maximum": 9007199254740991
    },
    "__schema19": {
      "minItems": 1,
      "type": "array",
      "items": {
        "$ref": "#/definitions/__schema20"
      }
    },
    "__schema20": {
      "type": "object",
      "properties": {
        "id": {
          "$ref": "#/definitions/EventId"
        },
        "template": {
          "$ref": "#/definitions/TemplateId"
        },
        "params": {
          "type": "object",
          "propertyNames": {
            "$ref": "#/definitions/Name"
          },
          "additionalProperties": {
            "type": "number"
          }
        },
        "pendingRefs": {
          "type": "array",
          "items": {
            "$ref": "#/definitions/PendingRef"
          }
        }
      },
      "required": [
        "id",
        "template",
        "params"
      ],
      "additionalProperties": false
    },
    "EventId": {
      "type": "string",
      "pattern": "^e[1-9]\\d*$"
    },
    "TemplateId": {
      "type": "string",
      "pattern": "^tpl\\.[a-z][a-z0-9_]*$"
    },
    "Name": {
      "type": "string",
      "pattern": "^[a-z][A-Za-z0-9_]{0,63}$"
    },
    "PendingRef": {
      "type": "string",
      "pattern": "^T\\d{2}$"
    },
    "__schema21": {
      "type": "array",
      "items": {
        "type": "string",
        "pattern": "^tm_[0123456789abcdefghjkmnpqrstvwxyz]{8}$"
      }
    },
    "__schema22": {
      "type": "array",
      "items": {
        "type": "object",
        "properties": {
          "chapter": {
            "type": "string",
            "pattern": "^ch_[0123456789abcdefghjkmnpqrstvwxyz]{6}$"
          },
          "level": {
            "type": "string",
            "pattern": "^lv_[0123456789abcdefghjkmnpqrstvwxyz]{8}$"
          }
        },
        "required": [
          "chapter"
        ],
        "additionalProperties": false
      }
    },
    "__schema23": {
      "type": "array",
      "items": {
        "type": "object",
        "properties": {
          "ref": {
            "type": "string"
          },
          "value": {
            "type": "number"
          }
        },
        "required": [
          "ref",
          "value"
        ],
        "additionalProperties": false
      }
    },
    "__schema24": {
      "type": "array",
      "items": {
        "$ref": "#/definitions/Target"
      }
    },
    "Target": {
      "oneOf": [
        {
          "$ref": "#/definitions/__schema25"
        },
        {
          "$ref": "#/definitions/__schema27"
        },
        {
          "$ref": "#/definitions/__schema28"
        },
        {
          "$ref": "#/definitions/__schema29"
        }
      ]
    },
    "__schema25": {
      "type": "object",
      "properties": {
        "id": {
          "$ref": "#/definitions/TargetId"
        },
        "kind": {
          "type": "string",
          "const": "line"
        },
        "line": {
          "$ref": "#/definitions/LineId"
        },
        "measure": {
          "$ref": "#/definitions/__schema26"
        }
      },
      "required": [
        "id",
        "kind",
        "line",
        "measure"
      ],
      "additionalProperties": false
    },
    "TargetId": {
      "type": "string",
      "pattern": "^t[1-9]\\d*$"
    },
    "LineId": {
      "type": "string",
      "pattern": "^(is|bs|cf|dc)_[a-z0-9_]+$"
    },
    "__schema26": {
      "type": "string",
      "enum": [
        "direction",
        "delta",
        "value"
      ]
    },
    "__schema27": {
      "type": "object",
      "properties": {
        "id": {
          "$ref": "#/definitions/TargetId"
        },
        "kind": {
          "type": "string",
          "const": "account"
        },
        "account": {
          "$ref": "#/definitions/SemanticId"
        },
        "measure": {
          "$ref": "#/definitions/__schema26"
        }
      },
      "required": [
        "id",
        "kind",
        "account",
        "measure"
      ],
      "additionalProperties": false
    },
    "__schema28": {
      "type": "object",
      "properties": {
        "id": {
          "$ref": "#/definitions/TargetId"
        },
        "kind": {
          "type": "string",
          "const": "ratio"
        },
        "ratioRef": {
          "$ref": "#/definitions/RatioRef"
        },
        "measure": {
          "type": "string",
          "enum": [
            "direction",
            "delta",
            "value",
            "status"
          ]
        }
      },
      "required": [
        "id",
        "kind",
        "ratioRef",
        "measure"
      ],
      "additionalProperties": false
    },
    "RatioRef": {
      "type": "string",
      "pattern": "^[a-z][a-z0-9_]*@(excel|slides03|slides02|dupont|slides01)$"
    },
    "__schema29": {
      "type": "object",
      "properties": {
        "id": {
          "$ref": "#/definitions/TargetId"
        },
        "kind": {
          "type": "string",
          "const": "check"
        },
        "step": {
          "anyOf": [
            {
              "type": "number",
              "const": 2
            },
            {
              "type": "number",
              "const": 3
            },
            {
              "type": "number",
              "const": 4
            },
            {
              "type": "number",
              "const": 5
            }
          ]
        },
        "measure": {
          "type": "string",
          "const": "value"
        }
      },
      "required": [
        "id",
        "kind",
        "step",
        "measure"
      ],
      "additionalProperties": false
    },
    "__schema30": {
      "type": "array",
      "items": {
        "type": "object",
        "properties": {
          "role": {
            "type": "string",
            "pattern": "^[a-z][a-z0-9_]*$"
          },
          "positive": {
            "$ref": "#/definitions/LocalizedText"
          },
          "negative": {
            "$ref": "#/definitions/LocalizedText"
          },
          "advice": {
            "$ref": "#/definitions/LocalizedText"
          }
        },
        "required": [
          "role",
          "positive",
          "negative",
          "advice"
        ],
        "additionalProperties": false
      }
    },
    "__schema31": {
      "type": "string",
      "enum": [
        "excel_verified",
        "inferred"
      ]
    }
  }
}
